"Status","Start Time","Stop Time","Duration in ms","Parent Suite","Suite","Sub Suite","Test Class","Test Method","Name","Description"
"failed","Fri Jul 18 22:48:33 UTC 2025","Fri Jul 18 22:48:38 UTC 2025","4072","","","","","","Create a new product and validate DB",""
"passed","Fri Jul 18 22:48:38 UTC 2025","Fri Jul 18 22:48:41 UTC 2025","3078","","","","","","Login with valid credentials",""
"passed","Fri Jul 18 22:48:41 UTC 2025","Fri Jul 18 22:48:45 UTC 2025","4649","","","","","","Search for an existing user",""
"failed","Fri Jul 18 22:48:29 UTC 2025","Fri Jul 18 22:48:33 UTC 2025","4144","","","","","","Fetch all available products and validate DB",""
"passed","Fri Jul 18 22:48:38 UTC 2025","Fri Jul 18 22:48:38 UTC 2025","11","","","","","","Process a valid payment",""
"passed","Fri Jul 18 22:48:38 UTC 2025","Fri Jul 18 22:48:38 UTC 2025","6","","","","","","Process an invalid payment",""
